[
  {
    "task_id": "dmrb-001",
    "title": "Log system startup notice",
    "description": "Record that the DMRB system was initialized.",
    "priority": 1,
    "status": "pending",
    "action_type": "log_only",
    "action_payload": {
      "message": "DMRB Production system initialized and ready."
    },
    "created_at": "2026-03-20T22:00:00+00:00",
    "updated_at": "2026-03-20T22:00:00+00:00"
  },
  {
    "task_id": "dmrb-002",
    "title": "Run DB migration check script",
    "description": "Execute the migration health-check script inside the project.",
    "priority": 2,
    "status": "pending",
    "action_type": "run_script",
    "action_payload": {
      "script": "scripts/check_migrations.sh",
      "args": ["--env", "prod"],
      "timeout_seconds": 30
    },
    "created_at": "2026-03-20T22:00:00+00:00",
    "updated_at": "2026-03-20T22:00:00+00:00"
  },
  {
    "task_id": "dmrb-003",
    "title": "Generate environment config file",
    "description": "Write a default .env.generated file for local dev setup.",
    "priority": 3,
    "status": "pending",
    "action_type": "generate_file",
    "action_payload": {
      "path": ".env.generated",
      "content": "# Auto-generated by task worker\nSUPABASE_URL=\nDATABASE_URL=\n",
      "overwrite": false
    },
    "created_at": "2026-03-20T22:00:00+00:00",
    "updated_at": "2026-03-20T22:00:00+00:00"
  }
]
